{
  "id": "trisha_myler_lexitas_dallas",
  "display_name": "Trisha Myler — Lexitas (Dallas)",
  "reporter_name": "Trisha Myler",
  "csr_number": "3465",
  "csr_expiration": "04/30/2022",
  "credentials": "CSR, RPR, CRR, RMR",
  "method": "machine shorthand",
  "firm_name": "LEXITAS",
  "firm_registration_number": "459",
  "firm_reg_expiration": null,
  "reporter_address_line1": "325 N. St. Paul, Suite 1900",
  "reporter_address_line2": null,
  "reporter_city": "Dallas",
  "reporter_state": "Texas",
  "reporter_zip": "75201",
  "reporter_phone": null,
  "reporter_email": null,
  "chassis_default": "template_native"
}
